<!ELEMENT BOOK (TITLE,AUTHOR,EDITION,PRICE)>
<!ELEMENT TITLE (#PCDATA)>
<!ELEMENT AUTHOR (#PCDATA)>
<!ELEMENT EDITION (#PCDATA)>
<!ELEMENT PRICE (#PCDATA)>
<!ELEMENT BOOKDATA (BOOK*)>
